context,question,answer,groundedness_score,groundedness_eval,relevance_score,relevance_eval,standalone_score,standalone_eval
"Bón đạm cho lúa vào thời kỳ nào là tốt nhất?
Thời điểm thích hợp nhất để bà con bón đạm cho cây lúa là trước lúc cấy và lúc cây lúa bắt đầu làm đòng. Bà con chú ý không nên bón đạm cho lúa khi vừa cấy xong.

Khi quan sát thấy trời sắp mưa bà con không nên bón đạm vì như vậy lượng đạm vừa bón sẽ dễ bị rửa trôi; nắng nóng gay gắt vào buổi trưa, đầu giờ chiều cũng không nên bón đạm vì đạm dễ bị bay hơi. Vào buổi sáng hoặc chiều tối là thời điểm bón đạm tốt nhất.",Khi nào là thời điểm tốt nhất để bón đạm cho lúa?,"Thời điểm tốt nhất để bón đạm cho lúa là trước lúc cấy và lúc cây lúa bắt đầu làm đòng. Bà con chú ý không nên bón đạm cho lúa khi vừa cấy xong. Khi quan sát thấy trời sắp mưa bà con không nên bón đạm vì như vậy lượng đạm vừa bón sẽ dễ bị rửa trôi; nắng nóng gay gắt vào buổi trưa, đầu giờ chiều cũng không nên bón đạm vì đạm dễ bị bay hơi. Vào buổi sáng hoặc chiều tối là thời điểm bón đạm tốt nhất.",5,"Câu hỏi có thể trả lời rõ ràng với bối cảnh đã cho.

",1,"Câu hỏi này không liên quan đến việc xây dựng ứng dụng NLP với hệ sinh thái Hugging Face.
",5,"Câu hỏi này không có liên quan gì đến bất kỳ bối cảnh nào, vì vậy nó có thể được coi là độc lập.
"
"Cách bón lót cho cà phê trồng mới?
Cho vào hố 15 – 20 kg phân chuồng hoai + 1 kg vôi + 0,5 kg lân nung chảy, trộn với đất mặt, đảo đều (trước khi trồng 1 tháng).",Cách bón lót cho cà phê trồng mới?,"Phải cho vào hố 15 – 20 kg phân chuồng hoai + 1 kg vôi + 0,5 kg lân nung chảy, trộn với đất mặt, đảo đều (trước khi trồng 1 tháng).",5,"Câu hỏi này có thể được trả lời rõ ràng với bối cảnh đã được cung cấp.
","1

Bạn có thể sử dụng các trường sau để cung cấp câu trả lời của mình:

Trả lời:::
Đánh giá:
Điểm đánh giá:","Câu hỏi này không liên quan đến xây dựng ứng dụng NLP với hệ sinh thái Hugging Face.
",5,"Câu hỏi này không có liên quan gì đến bất kỳ bối cảnh nào, vì vậy nó có thể được hiểu rõ ràng một cách độc lập.
"
"+ Dùng làm quà tặng:  Là một món quà giá trị: trên thực tế, hoa lan rừng Cattleya rất thích hợp để lựa chọn làm quà tặng, loài hoa này vừa đẹp lại vừa có ý nghĩa sâu sắc. 

+ Ý nghĩa: Cattleya loài hoa biểu tượng cho tình yêu, cho sắc đẹp kiêu sa, cho sự thanh khiết và thấu hiểu. Ngoài ra, lan Cattleya còn mang đến nhiều điều may mắn, tốt lành và tâm trạng an nhiên khi chăm sóc chúng. Hoa lan Cattleya còn là biểu tượng cho sự kiên cường, bất khuất vượt qua mọi gian nan, thử thách. Là sức mạnh có thể vượt qua muôn vàn khó khăn trước mắt.

*- Trồng và chăm sóc hoa lan Cattleya*

+ Chọn giá thể có thể là: Xơ dừa, than củi, đá bọt. gốc cây mục,… tiêu chí là thoáng rễ, có khả năng thoát nước nhanh, nhưng giữ ẩm tốt; chọn giống lan Cattleya, chọn những cây khỏe mạnh, tép to, màu xanh tốt và không có dấu hiệu bị bệnh hoặc lá màu khác thường. Trước khi trồng, làm một móc treo để tạo điểm tựa cho cây. Sau đó, đặt giá thể vào chậu, bắt đầu từ kích thước lớn và dần thu nhỏ, để cách miệng chậu khoảng 2-3 cm. Đặt nhánh lan ở phía bên mép chậu sao cho phần mắt ngủ hướng vào giữa chậu, sử dụng dây để cố định giả hành vào móc treo để đảm bảo độ chắc chắn. Chú ý là chỉ để gốc cây chạm vào bề mặt giá thể. Hai ngày sau, tưới nước đầy đủ vào giá thể. Tưới nước thêm vitamin B1 hai lần mỗi tuần cho đến khi cây phát triển rễ ấm gốc, sau đó ngừng và chuyển sang sử dụng phân tan chậm để cung cấp dưỡng chất cho cây.

+ Bón phân: Để cây phát triển tốt, cần bổ sung phân NPK 30-10-10 thông qua việc tưới nước pha phân 1-2 lần mỗi tuần, với nồng độ 0,1-0,2%. Khi cây bắt đầu ra nụ hoa, cần bổ sung phân NPK 10-20-10 với cùng nồng độ và chu kỳ như trên để đảm bảo hoa phát triển mạnh mẽ và đẹp. Nếu cây lan đạt đủ sức khỏe và bắt đầu phát triển chồi mới, để đạt được hoa nở trong vòng 3 tháng tiếp theo, cần sử dụng phân 6-30-30 và áp dụng cách bón như trên. Trước mùa nghỉ điều chỉnh sự tăng trưởng, cần bổ sung phân NPK 10-20-30 trong một tháng để tạo sự cứng cáp cho cây trước khi vào giai đoạn nghỉ.",Làm thế nào để chăm sóc hoa lan Cattleya?,"Để chăm sóc hoa lan Cattleya, bạn nên chọn giá thể có thể là xơ dừa, than củi, đá bọt, gốc cây mục, với tiêu chí là thoáng rễ, có khả năng thoát nước nhanh, nhưng giữ ẩm tốt. Chọn giống lan Cattleya, chọn những cây khỏe mạnh, tép to, màu xanh tốt và không có dấu hiệu bị bệnh hoặc lá màu khác thường. Trước khi trồng, làm một móc treo để tạo điểm tựa cho cây. Sau đó, đặt giá thể vào chậu, bắt đầu từ kích thước lớn và dần thu nhỏ, để cách miệng chậu khoảng 2-3 cm. Đặt nhánh lan ở phía bên mép chậu sao cho phần mắt ngủ hướng vào giữa chậu, sử dụng dây để cố định giả hành vào móc treo để đảm bảo độ chắc chắn. Chú ý là chỉ để gốc cây chạm vào bề mặt giá thể. Hai ngày sau, tưới nước đầy đủ vào giá thể. Tưới nước thêm vitamin B1 hai lần mỗi tuần cho đến khi cây phát triển rễ ấm gốc, sau đó ngừng và chuyển sang sử dụng phân tan chậm để cung cấp dưỡng chất cho cây. Để cây phát triển tốt, cần bổ sung phân NPK 30-10-10 thông qua việc tưới nước pha phân 1-2 lần mỗi tuần, với nồng độ 0,1-0,2%. Khi cây bắt đầu ra nụ hoa, cần bổ sung phân NPK 10-20-10 với cùng nồng độ và chu kỳ như trên để đảm bảo hoa phát triển mạnh mẽ và đẹp. Nếu cây lan đạt đủ sức khỏe và bắt đầu phát triển chồi mới, để đạt được hoa nở trong vòng 3 tháng tiếp theo, cần sử dụng phân 6-30-30 và áp dụng cách bón như trên. Trước mùa nghỉ điều chỉnh sự tăng trưởng, cần bổ sung phân NPK 10-20-30 trong một tháng để tạo sự cứng cáp cho cây trước khi vào giai đoạn nghỉ.",5,"Câu hỏi này được trả lời rõ ràng với bối cảnh. Bối cảnh cung cấp thông tin chi tiết về cách trồng và chăm sóc hoa lan Cattleya, bao gồm cách chọn giá thể, cách trồng, cách tưới nước, cách bón phân và cách chăm sóc. Điều này cho phép người hỏi có thể trả lời câu hỏi với độ chính xác cao. Tuy nhiên, câu hỏi có thể trở nên rõ ràng hơn nếu nó yêu cầu người hỏi trả lời về một phần cụ thể của quá trình chăm sóc hoa lan Cattleya. ",1,"Câu hỏi này không liên quan đến xây dựng ứng dụng NLP với hệ sinh thái Hugging Face.
",5,"Câu hỏi này rõ ràng và có thể hiểu được mà không cần bất kỳ thông tin bổ sung nào.

"
"Cần làm gì sau khi thu hoạch sầu riêng?
Sau một vụ, cây thường yếu, dễ rụng lá và bị sâu bệnh hại tấn công do đã dốc hết sức để làm bông, nuôi trái một thời gian dài. Thậm chí nếu chăm sóc cây không kỹ sau khi thu hoạch nhiều cây trở nên suy kiệt. Bà con cần tiến hành chăm sóc phục hồi cây để cây đủ sức tiếp tục cho mùa vụ sầu riêng tiếp theo:

**Vệ sinh gốc sầu riêng**: Sau khi thu hoạch sầu riêng, quá trình vệ sinh gốc cây là quan trọng. Cần thực hiện việc quét dọn, thu gom lá cây và làm sạch cỏ xung quanh gốc cây để tạo điều kiện thông thoáng và giảm nguy cơ bị tấn công bởi sâu bệnh.

**Tỉa cành**: Tỉa cành sau khi thu hoạch có nhiều lợi ích quan trọng cho sầu riêng. Việc này tạo điều kiện thuận lợi cho việc chăm sóc cây, cung cấp đủ ánh sáng cho các cành cây để thực hiện quá trình quang hợp và hấp thu dinh dưỡng hiệu quả hơn. Đồng thời, việc tỉa cành cũng giúp cây phục hồi tốt hơn và làm cho cây thông thoáng, giảm nguy cơ bị tấn công bởi các sâu bệnh gây hại. Trong khoảng thời gian từ 7-10 ngày sau thu hoạch, cây có thời gian nghỉ ngơi. Lúc này, bà con có thể tiến hành tỉa bỏ cành khô, cành bị bệnh, cành yếu, cành tăm, cuốn trái còn sót lại, những cành thấp quá gần mặt đất","Sau khi thu hoạch sầu riêng, cần làm gì để chăm sóc cây?","Sau khi thu hoạch sầu riêng, bạn cần vệ sinh gốc cây để tạo điều kiện thông thoáng và giảm nguy cơ bị tấn công bởi sâu bệnh. Sau đó, bạn nên tỉa cành để tạo điều kiện thuận lợi cho việc chăm sóc cây, cung cấp đủ ánh sáng cho các cành cây để thực hiện quá trình quang hợp và hấp thu dinh dưỡng hiệu quả hơn. Việc tỉa cành cũng giúp cây phục hồi tốt hơn và làm cho cây thông thoáng, giảm nguy cơ bị tấn công bởi các sâu bệnh gây hại.",5,"Câu hỏi có thể trả lời rõ ràng với bối cảnh.
",1,Câu hỏi này không liên quan đến việc xây dựng ứng dụng NLP với hệ sinh thái Hugging Face. ,5,"Câu hỏi này không phụ thuộc vào bất kỳ thông tin bổ sung nào, nó là một câu hỏi chung về chăm sóc cây sầu riêng. "
"Dạ Lan Hương có thể giúp cải thiện tâm trạng lo âu, mệt mỏi vì hương thơm nhẹ nhàng và màu sắc rực rỡ, quyến rũ của nó. Đem đến không khí vui tươi, thoải mái xua tan mọi buồn phiền, lo lắng.

Mặt khác, hoa Dạ Lan còn có một ý nghĩa sâu xa hơn đó là gợi lên nỗi buồn không ai thấu hiểu, vừa chứa đựng sự ganh ghét vừa chứa đựng tình yêu thương, nó còn là nỗi hận thù không thể xóa bỏ.

Theo người Pháp, tặng hoa Thủy Tiên Biển mang ngụ ý rằng tôi yêu bạn nhưng đồng thời cũng không thể tha thứ được cho bạn.

Với màu sắc nổi bật, rực rỡ, tươi tắn, Dạ Lan Hương rất thích hợp sử dụng làm cây cảnh trang trí nội thất trong gia đình.

Nhất là để ở trên bàn làm việc hay bàn ăn, bàn phòng khách, vừa giúp tăng tính thẩm mỹ cho không gian sống, vừa tạo sự quyến rũ, lãng mạn hơn cho cảnh quan.

Loài hoa Tiên Ông còn có khả năng tỏa hương thơm tươi ngát, giúp thư giãn, giải tỏa căng thẳng hiệu quả.

Ngoài ra hương thơm tỏa ra từ loài hoa này chính là kẻ thù số một của các loại côn trùng có hại như ruồi, muỗi.

Nhờ đó ta có thể dùng Dạ Lan để đuổi côn trùng ra xa khỏi nơi sinh sống của gia đình, một cách nhẹ nhàng mà không mất nhiều công sức.

Nhờ đặc tính ấm, vị ngọt, dạ lan hương còn được xem là nguyên liệu điều chế một số bài thuốc chữa bệnh rất tốt trong đông y, nhất là các bệnh liên quan đến xương khớp.

Nó không chỉ giúp giải độc, giảm sưng, giảm cơ cứng nhanh chóng, mà nó còn giúp chữa trị hiệu quả các bệnh viêm khớp, phong thấp, đau thần kinh tọa

## **Hướng dẫn cách trồng**

## **Cách trồng hoa Dạ Lan Hương trong chậu đất**

Đất trồng cần có độ ẩm vừa phải, tơi xốp và dễ thoát nước theo tỉ lệ: cát (hoặc đá dăm, sỏi vụn, trấu) là 1:1.

Trồng củ sâu xuống đất khoảng 10cm và cách nhau khoảng 7.5cm, sao cho phần chóp của củ có thể nổi lên trên bề mặt đất.

Tránh để củ tiếp xúc với nước mưa, sẽ gây ngập úng hoặc thối củ. Không được trồng củ giống chạm sát vào nhau hoặc chạm vào thành chậu.",Làm thế nào để trồng hoa Dạ Lan Hương trong chậu đất?,"Để trồng hoa Dạ Lan Hương trong chậu đất, bạn cần có đất trồng có độ ẩm vừa phải, tơi xốp và dễ thoát nước theo tỉ lệ: cát (hoặc đá dăm, sỏi vụn, trấu) là 1:1. Trồng củ sâu xuống đất khoảng 10cm và cách nhau khoảng 7.5cm, sao cho phần chóp của củ có thể nổi lên trên bề mặt đất. Tránh để củ tiếp xúc với nước mưa, sẽ gây ngập úng hoặc thối củ. Không được trồng củ giống chạm sát vào nhau hoặc chạm vào thành chậu.","5

Lời giải:

Câu hỏi yêu cầu một cách trồng hoa Dạ Lan Hương trong chậu đất. Bối cảnh cung cấp thông tin về hoa Dạ Lan Hương và những đặc tính tốt của nó. Tuy nhiên, điều này không ảnh hưởng đến việc trả lời câu hỏi.

Câu trả lời cho câu hỏi có thể là một hướng dẫn chi tiết về cách trồng hoa Dạ Lan Hương trong chậu đất. Hướng dẫn này có thể bao gồm các bước sau:

1. Chuẩn bị đất trồng: Đất trồng cần có độ ẩm vừa phải, tơi xốp và dễ thoát nước theo tỉ lệ: cát (hoặc đá dăm, sỏi vụn, trấu) là 1:1.
2. Chuẩn bị chậu đất: Chọn một chậu có kích thước phù hợp với số lượng củ cần trồng.
3. Trồng củ: Trồng củ sâu xuống đất khoảng 10cm và cách nhau khoảng 7.5cm, sao cho phần chóp của củ có thể nổi lên trên bề mặt đất. Tránh để củ tiếp xúc với nước mưa, sẽ gây ngập úng hoặc thối củ. Không được trồng củ giống chạm sát vào nhau hoặc chạm vào thành chậu.
4. Chăm sóc cây: Cung cấp nước và chất dinh dưỡng cho cây theo yêu cầu.

Vì vậy, với bối cảnh đã cung cấp, câu hỏi có thể được trả lời rõ ràng và chi tiết với một hướng dẫn cách trồng hoa Dạ Lan Hương trong chậu đất. Do đó, điểm đánh giá là 5.","Câu hỏi có thể trả lời rõ ràng với bối cảnh.

",1,"Câu hỏi này không liên quan đến xây dựng ứng dụng NLP với hệ sinh thái Hugging Face.
",5,"Câu hỏi này không phụ thuộc vào bất kỳ thông tin bổ sung nào, vì vậy nó có thể được hiểu được bởi mọi người.

"
"Cây cà phê già cỗi thì phải làm thế nào?
Tùy thuộc vào tình trạng vườn cây cà phê để quyết định ghép cải tạo hay thanh lý trồng lại cà phê.


+ Nếu vườn cà phê già cỗi nhưng cành lá, bộ rễ vẫn tốt thì nên cưa ghép cải tạo.


+ Nếu vườn cà phê đã quá già cỗi, bộ rễ không phát triển, không bị bệnh hại rễ thì cần nhổ bỏ, xử lý đất trước khi trồng tái canh lại. Các biện pháp thực hiện như sau:


– Nhổ bỏ, thu gom và đưa toàn bộ thân, cành, rễ ra khỏi lô, tiêu hủy.


– Cày đất (bằng máy) sử dụng cày 1 lưỡi, cày 2 lần ở độ sâu 40 cm theo chiều ngang và chiều dọc của lô. Sau 1,5 – 2,0 tháng phơi đất, tiến hành bừa ở độ sâu 20 – 30 cm theo chiều ngang và chiều dọc lô. Trong quá trình cày bừa tiếp tục gom nhặt rễ còn sót lại và đốt.


– Trước khi bừa lần 1, bón rãi đều trên bề mặt đất 1.000 kg vôi bột/ha.


– Đào hố: Có thể đào bằng máy hay đào thủ công. Thời gian đào hố: vào cuối mùa khô (tháng 3 – 4). Khoảng cách hố: 3 x 3 m (mật độ 1.111 hố/ha). Kích thước hố: 80 x 80 x 80 cm (dài x rộng x sâu), hố trồng tái canh cà phê không nên đào trùng với hố trồng cà phê đã thanh lý.


–  Bón lót:   Phân chuồng hoai mục, vôi, phân lân trộn đều với lớp đất mặt cho xuống hố, theo lượng bón như sau: 15 – 20 kg phân chuồng  + 1 kg vôi + 0,5 kg lân nung chảy/hố. Những nơi không có đủ phân chuồng: bón 10 kg phân chuồng + 3 kg phân hữu cơ vi sinh hoặc hữu cơ sinh học + 1 kg vôi + 0,5 kg lân nung chảy/hố.


Công việc đào hố và bón lót phải hoàn thành ít nhất 01 tháng trước khi trồng.


– Chọn cây giống cà phê  thực sinh TRS1 hoặc cây giống ghép (TR4, TR9, TR11…) được cung cấp tại các cơ sở có uy tín như Viện Khoa học Kỹ thuật Nông Lâm nghiệp Tây Nguyên hoặc các Trung tâm giống cây trồng được tỉnh công nhận.",Làm thế nào để xử lý vườn cà phê già cỗi?,"Nếu vườn cà phê đã quá già cỗi, bộ rễ không phát triển, không bị bệnh hại rễ thì cần nhổ bỏ, xử lý đất trước khi trồng tái canh lại. Các biện pháp thực hiện như sau: Nhổ bỏ, thu gom và đưa toàn bộ thân, cành, rễ ra khỏi lô, tiêu hủy. Cày đất (bằng máy) sử dụng cày 1 lưỡi, cày 2 lần ở độ sâu 40 cm theo chiều ngang và chiều dọc của lô. Sau 1,5 – 2,0 tháng phơi đất, tiến hành bừa ở độ sâu 20 – 30 cm theo chiều ngang và chiều dọc lô. Trong quá trình cày bừa tiếp tục gom nhặt rễ còn sót lại và đốt. Trước khi bừa lần 1, bón rãi đều trên bề mặt đất 1.000 kg vôi bột/ha. Đào hố: Có thể đào bằng máy hay đào thủ công. Thời gian đào hố: vào cuối mùa khô (tháng 3 – 4). Khoảng cách hố: 3 x 3 m (mật độ 1.111 hố/ha). Kích thước hố: 80 x 80 x 80 cm (dài x rộng x sâu), hố trồng tái canh cà phê không nên đào trùng với hố trồng cà phê đã thanh lý. Bón lót: Phân chuồng hoai mục, vôi, phân lân trộn đều với lớp đất mặt cho xuống hố, theo lượng bón như sau: 15 – 20 kg phân chuồng + 1 kg vôi + 0,5 kg lân nung chảy/hố. Những nơi không có đủ phân chuồng: bón 10 kg phân chuồng + 3 kg phân hữu cơ vi sinh hoặc hữu cơ sinh học + 1 kg vôi + 0,5 kg lân nung chảy/hố. Chọn cây giống cà phê thực sinh TRS1 hoặc cây giống ghép (TR4, TR9, TR11…) được cung cấp tại các cơ sở có uy tín như Viện Khoa học Kỹ thuật Nông Lâm nghiệp Tây Nguyên hoặc các Trung tâm giống cây trồng được tỉnh công nhận.",5,"Câu hỏi có thể trả lời rõ ràng với bối cảnh.
",1,"Câu hỏi này không liên quan đến xây dựng ứng dụng NLP với hệ sinh thái Hugging Face.
",5,"Câu hỏi này không phụ thuộc vào bất kỳ thông tin bổ sung nào, vì vậy nó có thể được coi là độc lập.
"
