context,question,answer,groundedness_score,groundedness_eval,relevance_score,relevance_eval,standalone_score,standalone_eval
"Sầu riêng
Durio zibethinus (được gọi là Sầu riêng Đông Nam Á) là loài thực vật thuộc chi Sầu riêng phổ biến nhất.",Loài thực vật thuộc chi Sầu riêng nào là loài phổ biến nhất?,Durio zibethinus (Sầu riêng Đông Nam Á) là loài thực vật thuộc chi Sầu riêng phổ biến nhất.,5,"Câu hỏi được đặt rõ ràng và có thể trả lời được với bối cảnh đã cho.
",1,"Câu hỏi này không liên quan đến việc xây dựng các ứng dụng NLP với hệ sinh thái Hugging Face.
",5,"Câu hỏi này không phụ thuộc vào bất kỳ thông tin bổ sung nào, vì vậy nó có thể được hiểu rõ ràng với một người có kiến thức về các loài thực vật.

"
"Kỹ thuật cắt tỉa cành và tạo tán cho cà phê
Cắt tỉa và tạo tán là kỹ thuật quan trọng trong việc trồng và quản lý cây cà phê, giúp cải thiện chất lượng và năng suất của cây. Tuy nhiên, quá trình cắt tỉa cần thực hiện vào thời điểm trước khi tiến hành bón phân và trước khi mùa mưa bắt đầu.

**Tạo hình cơ bản**: Cắt tỉa các chồi mọc từ gốc hoặc từ chồi nách của thân cây, và cần thực hiện cắt tỉa đều đặn để mỗi hố chỉ có một thân chính. Hãm ngọn cây ở độ cao 1,6 -1,7m.

**Tạo hình nuôi quả:** Loại bỏ các cành thấp cách mặt đất khoảng 20-25cm để cải thiện sự thông thoáng cho cây. Cần cắt tỉa các cành yếu, dập, và bị nhiễm bệnh sao cho mỗi đốt cây còn lại 3 cành dự phòng. Đồng thời, cắt tỉa các cành ngắn ở phía trên để đảm bảo ánh sáng có thể trải đều cho các cành ở phía dưới, từ đó tối ưu hóa hiệu suất trong quá trình trồng và chăm sóc cây cà phê.",Khi nào là thời điểm tốt nhất để thực hiện kỹ thuật cắt tỉa và tạo tán cho cây cà phê?,Thời điểm tốt nhất để thực hiện kỹ thuật cắt tỉa và tạo tán cho cây cà phê là trước khi tiến hành bón phân và trước khi mùa mưa bắt đầu.,5,"Câu hỏi này rõ ràng và có thể trả lời được với bối cảnh đã được cung cấp.
",1,"Câu hỏi này không liên quan đến xây dựng ứng dụng NLP với hệ sinh thái Hugging Face.
",5,"Câu hỏi này không phụ thuộc vào bất kỳ thông tin bổ sung nào, vì vậy nó có thể được coi là độc lập.

"
"Lục bình
Đang cập nhật data về cây trồng này. Bạn có thể sử dụng tính năng đóng góp dữ liệu để giúp chúng tôi cải thiện mô hình nhận dạng ..",Lục bình có phải là loại cây trồng nông nghiệp?,Lục bình là một loại cây trồng nông nghiệp. Nó thường được trồng để sản xuất bột để làm bánh và cũng được sử dụng để chế biến mỹ phẩm và thuốc.,3,"Câu hỏi có thể được trả lời với bối cảnh đã cho, nhưng câu trả lời có thể không chính xác vì dữ liệu chưa được cập nhật.
",1,"Câu hỏi này không liên quan đến việc xây dựng ứng dụng NLP với hệ sinh thái Hugging Face.
",5,"Câu hỏi này không phụ thuộc vào bất kỳ thông tin bổ sung nào, vì lục bình là một loại cây được biết đến rộng rãi.
"
"Hồ tiêu
**Hồ tiêu** còn gọi là **tiêu ăn**, **cổ nguyệt**, **hắc cổ nguyệt**, **bạch cổ nguyệt** (danh pháp khoa học: *Piper nigrum*) là một loài [cây leo](https://vi.wikipedia.org/w/index.php?title=C%C3%A2y_leo&action=edit&redlink=1) [có hoa](https://vi.wikipedia.org/w/index.php?title=Th%E1%BB%A5_v%E1%BA%ADt_c%C3%B3_hoa&action=edit&redlink=1) thuộc [họ Hồ tiêu](https://vi.wikipedia.org/wiki/H%E1%BB%8D_H%E1%BB%93_ti%C3%AAu) (*Piperaceae*), trồng chủ yếu để lấy [quả](https://vi.wikipedia.org/wiki/Qu%E1%BA%A3) và hạt, thường dùng làm [gia vị](https://vi.wikipedia.org/wiki/Gia_v%E1%BB%8B) dưới dạng khô hoặc tươi.",Làm thế nào để trồng hồ tiêu?,"Để trồng hồ tiêu, bạn cần chuẩn bị một vùng đất mềm, đủ độ ẩm và được trồng trọc. Sau đó, bạn trồng hạt hồ tiêu vào đất và chăm sóc chúng đều đặn. Hạt hồ tiêu sẽ phát triển thành cây leo và bắt đầu tạo ra quả sau khoảng 3-4 tháng.",5,"Câu hỏi này rõ ràng và đơn giản.
",1,"Câu hỏi này không liên quan đến việc xây dựng ứng dụng NLP với hệ sinh thái Hugging Face.
",5,"Câu hỏi này không phụ thuộc vào bất kỳ thông tin bổ sung nào, vì vậy nó có thể được coi là độc lập.
"
"*- Cách trồng và chăm sóc lan Vanda:* Để có những giò lan Vanda tốt cần phải đảm bảo các điều kiện sau

+ Nhiệt độ và độ ẩm:.nhiệt độ từ 25 – 30 độ C là tốt nhất để lan Vanda sinh trưởng và phát triển. Nếu ở nhiệt độ nóng hơn bạn cần che mát cho cây, còn nếu nhiệt độ lạnh hơn cần thắp đèn cho lan để tăng nhiệt độ .Độ ẩm cần thiết để cho lan phát triển tốt khoảng 70% – 80%, nếu ko Van đa sẽ bị héo lá và yếu dần.

+ Nước:.để đảm bảo được độ ẩm cao giúp cây phát triển tốt cần tước nước nhiều đặc biệt là mùa khô. Đối với các nhà vườn bạn cần phải tưới ngày 2 đến 3 lần đặc biệt trong mùa nắng nóng hiện nay nước bốc hơi rất nhanh nên cần phải tưới nhiều có khi đến 5 lần để đảm bảo độ ẩm tốt cho cây phát triển

+ Ánh sáng:.Lan Vanda thuộc dòng ưa sáng và nở hoa khi có ánh sáng nhiều. Ngoài ra ánh sáng cũng giúp diệt trừ nấm mốc gây hại, giúp cây phát triển tốt hơn. Nhưng cũng không nên để ánh nắng chiếu trực tiếp ở nhiệt độ cao sẽ làm cây cháy lá.

+ Phân bón và thuốc trừ sâu:.lan Vanda là loại lan có nhu cầu phân bón cao có thể bón các loại phân hữu cơ hay phân dê, phân bò khô đều tốt. Thời kì gần ra hoa, chú ý bón thêm phân N.P.K bổ sung dinh dưỡng cho cây.

+ Thay chậu và nhân giống:.Khi cây Vanda sinh trưởng và phát triển tốt gây mất cân đối giữa cây và chậu, cần thay chậu để đảm bảo cho cây phát triển tốt. Thích hợp nhất cho việc thay chậu là vào đầu mùa mưa. Và sau khi thay chậu ta cần phun dung dịch kích rễ N3m hoặc ANA để cây có bộ rễ khỏe đáp ứng đủ yêu cầu cần thiết. Đối với Vanda rừng việc nhân giống là thuần hóa từ những cây đưa từ rừng về và đẻ tự nhiên. Còn đối với Vanda cấy mô chúng ta thường mua cây còn rồi nuôi lớn và sinh trưởng",Làm thế nào để chăm sóc đúng cây lan Vanda?,"Để chăm sóc đúng cây lan Vanda, bạn cần đảm bảo các điều kiện sau: nhiệt độ từ 25 – 30 độ C, độ ẩm khoảng 70% – 80%, tưới nước nhiều, ánh sáng nhiều, bón phân hữu cơ hoặc phân dê, phân bò khô, thay chậu và nhân giống khi cây sinh trưởng và phát triển tốt.",5,"Câu hỏi có thể trả lời rõ ràng với bối cảnh đã cho.

",1,"Câu hỏi này không liên quan đến xây dựng ứng dụng NLP với hệ sinh thái Hugging Face.
",5,"Câu hỏi này rõ ràng và có thể hiểu được mà không cần bất kỳ thông tin bổ sung nào.
"
"Đối với cây trồng ở văn phòng và trong nhà thì cần tưới nước cho cây 2 lần/tuần và thay nước 1 tuần/lần.

**- Liên kết ngoài:**

1: <https://webcaycanh.com/cay-co-lan-chi/>

2. <https://vietnamnet.vn/cong-dung-y-nghia-cua-cay-lan-chi-nguoi-sanh-choi-cung-chua-chac-biet-630091.html>

3. <https://wikicaycanh.com/cay-day-nhen-co-lan-chi.html>",Mỗi bao nhiêu tuần cần tưới cây lan chi ở văn phòng và trong nhà?,Cây lan chi ở văn phòng và trong nhà cần tưới nước 2 lần/tuần.,5,"Câu hỏi này có thể trả lời rõ ràng với bối cảnh đã cho.

",1,"Câu hỏi này không liên quan đến xây dựng ứng dụng NLP với hệ sinh thái Hugging Face.
",5,"Câu hỏi này rõ ràng và độc lập với bất kỳ bối cảnh nào. Nó không yêu cầu thông tin bổ sung để được giải thích.

"
